{"candidateCohortHash":"sha256:73782f9dbd78291cf3d277fac9d13c302d524be2340fa5e3a21737c11481df86","candidateId":"scale500-tmdb-2654","cohortId":"SCALE_TRANCHE_1","schemaVersion":"promotion-candidate.v1","sourceHashes":{"evidencePacket":"sha256:aaf6071c04e0e5601a8cf0707e47ff3a9056fd7e0d04f49612f8fc0b42e5ac43","factsRecord":"sha256:5751fbe2e44643fe65c170307e87695de3ff8f428574745def3983a566a7474a","semanticArtifact":"sha256:7b65a1b9fc958430d7f4b6d68bda06935fd61303f872171a5fece46322ca08e9"},"tmdbId":2654}
