{"candidateCohortHash":"sha256:73782f9dbd78291cf3d277fac9d13c302d524be2340fa5e3a21737c11481df86","candidateId":"scale500-tmdb-5491","cohortId":"SCALE_TRANCHE_1","schemaVersion":"promotion-candidate.v1","sourceHashes":{"evidencePacket":"sha256:cc7b14df29b694dd6485b307b8ddf2ab8a4f62914cb7219d6de853673068a839","factsRecord":"sha256:3b2e302bf02a6d08d6698bfb9b123f3af99c7abcb46f9f8729112cdeb442f3ae","semanticArtifact":"sha256:ad816d7ae3962f02f28d60ca9632f3276f483ca68e21b0ce991f771217184fa9"},"tmdbId":5491}
