{"candidateCohortHash":"sha256:73782f9dbd78291cf3d277fac9d13c302d524be2340fa5e3a21737c11481df86","candidateId":"scale500-tmdb-10588","cohortId":"SCALE_TRANCHE_1","schemaVersion":"promotion-candidate.v1","sourceHashes":{"evidencePacket":"sha256:5c6cf67029dbc7bd8c79fc62c46a602a3b2dca6b84598596c014aa053503b8e6","factsRecord":"sha256:f86135962565f6b5623e44003eae88ce27f56ca1facb589f6c5c376371c62a86","semanticArtifact":"sha256:ca1025715a068edef051407c13d1e00b540d68b326c5f2e2b2a7ecdccb9dddcb"},"tmdbId":10588}
