{"candidateCohortHash":"sha256:73782f9dbd78291cf3d277fac9d13c302d524be2340fa5e3a21737c11481df86","candidateId":"exp100-tmdb-245916","cohortId":"SCALE_TRANCHE_1","schemaVersion":"promotion-candidate.v1","sourceHashes":{"evidencePacket":"sha256:1ac8cb5e8b2094ecd1cc7223b1e28fdb46069b55fc80ca3d38ff0b794f44e827","factsRecord":"sha256:bb4c8ac8052973e591a3b4d03f59c20a11bf9fd9725b052abca6762fc03f5aac","semanticArtifact":"sha256:7ab075a01d13f513ed0a56314e6b95083ec04c79a7461d2f607287a25b3948f3"},"tmdbId":245916}
