{"candidateCohortHash":"sha256:73782f9dbd78291cf3d277fac9d13c302d524be2340fa5e3a21737c11481df86","candidateId":"scale500-tmdb-254375","cohortId":"SCALE_TRANCHE_1","schemaVersion":"promotion-candidate.v1","sourceHashes":{"evidencePacket":"sha256:30a220378e689c3f3c3fbcd6b8dd8fe6d09808b0ad1ae34070017774a3ab9b4f","factsRecord":"sha256:2bcfa0bd9ee0e58297344b0b4046aa16fa340d757672242628a94ec5e25e53d6","semanticArtifact":"sha256:284de39c3372b67ca1a37dea2ec3eecc17bf52419ad487c3694d1b4146ef62b5"},"tmdbId":254375}
