{"candidateCohortHash":"sha256:73782f9dbd78291cf3d277fac9d13c302d524be2340fa5e3a21737c11481df86","candidateId":"scale500-tmdb-20714","cohortId":"SCALE_TRANCHE_1","schemaVersion":"promotion-candidate.v1","sourceHashes":{"evidencePacket":"sha256:37c2bd2b028c02bb278ebb219581251884f8bc964bfa3a04c3c62a340e3fdc4c","factsRecord":"sha256:601e9201b22602340c7b7cde618b2ecee300122ce183836b7ebf4d584525360b","semanticArtifact":"sha256:e98eac0c10e8cc691470b56d117a7c4e9fd738aa0ab1c71a39661e5f6168d8a0"},"tmdbId":20714}
