{"candidateCohortHash":"sha256:73782f9dbd78291cf3d277fac9d13c302d524be2340fa5e3a21737c11481df86","candidateId":"exp100-tmdb-22345","cohortId":"SCALE_TRANCHE_1","schemaVersion":"promotion-candidate.v1","sourceHashes":{"evidencePacket":"sha256:bfb0711b37e65889e846919e21e0e325176e00c2264c5bdcce231e16023c2d84","factsRecord":"sha256:0db00ed21ee7a5cb2e2d0641e4b7452546d180937928b6947320723e92813f6e","semanticArtifact":"sha256:15984835aec2d63f2c7b7746fe80b518c660d5731103917bcc7511c14d91787d"},"tmdbId":22345}
