{"candidateCohortHash":"sha256:73782f9dbd78291cf3d277fac9d13c302d524be2340fa5e3a21737c11481df86","candidateId":"scale500-tmdb-11559","cohortId":"SCALE_TRANCHE_1","schemaVersion":"promotion-candidate.v1","sourceHashes":{"evidencePacket":"sha256:403e0aaa45c359114041bd39a497949146d571d4c9750cd508d51674ba9b9815","factsRecord":"sha256:d1f33667620a2fd36bcb7e3d40417d0ae0449a44d1b454ad67be8b14dd85c6bf","semanticArtifact":"sha256:d8ea6699127bed40a8335f35412ac132ebb0a005dc84dcb053dc7fb1254aa017"},"tmdbId":11559}
