{"candidateCohortHash":"sha256:73782f9dbd78291cf3d277fac9d13c302d524be2340fa5e3a21737c11481df86","candidateId":"scale500-tmdb-446159","cohortId":"SCALE_TRANCHE_1","schemaVersion":"promotion-candidate.v1","sourceHashes":{"evidencePacket":"sha256:b5272d65072fcc066e50f3a970ac328508d4b593f467aecfd8a7a339606a6049","factsRecord":"sha256:102cceac4a5e558321f671513c57c42dc4b3fa068b124f4419c4b1b6efe33362","semanticArtifact":"sha256:dfb25e4f3579b0789aae906e601acc008cf2b7f25a2ae2fa151a9df11ccb7555"},"tmdbId":446159}
