{"candidateCohortHash":"sha256:73782f9dbd78291cf3d277fac9d13c302d524be2340fa5e3a21737c11481df86","candidateId":"scale500-tmdb-15283","cohortId":"SCALE_TRANCHE_1","schemaVersion":"promotion-candidate.v1","sourceHashes":{"evidencePacket":"sha256:45b9c5246c3f8409a692af04fd3b9bd8b6cbaa2bb8fbcae0ef2b6399b4314060","factsRecord":"sha256:5ce4f796c0460dd325e9bb260cc15c3a7c0f4a6d3917d0a4eb63a0b578ffee4b","semanticArtifact":"sha256:995ac86a4d3d21e1a535e8ecbc9aa6bcedf8cbac692d70ec8c52244d74e98ef8"},"tmdbId":15283}
