{"candidateCohortHash":"sha256:73782f9dbd78291cf3d277fac9d13c302d524be2340fa5e3a21737c11481df86","candidateId":"exp100-tmdb-670428","cohortId":"SCALE_TRANCHE_1","schemaVersion":"promotion-candidate.v1","sourceHashes":{"evidencePacket":"sha256:7abe5d3e78c5174f535fa57f4f626c0230bf359a29f88807ef783c340371d9aa","factsRecord":"sha256:4c2f0f592d154dd5087ec07c5c6d01d44aeb9067ec32ed21210083b15c8fad05","semanticArtifact":"sha256:03ba74dfa4be39ef95815dd878a049cd239b2c90635c835dc6ca37fa9fffe358"},"tmdbId":670428}
