{"candidateCohortHash":"sha256:73782f9dbd78291cf3d277fac9d13c302d524be2340fa5e3a21737c11481df86","candidateId":"exp100-tmdb-9349","cohortId":"SCALE_TRANCHE_1","schemaVersion":"promotion-candidate.v1","sourceHashes":{"evidencePacket":"sha256:db50cf0622c2d6f33a121d485c89b64888da9dabde453e43f897aeb71f79b5d8","factsRecord":"sha256:3747098d4fb8945a8765f5441e42a114502cab7ea8711bb558b0519f8b2e4c4e","semanticArtifact":"sha256:0f99c6a5cf790f1acca1f8a04c091a580b4924222b2959fe9b7b00e78eab8834"},"tmdbId":9349}
