{"candidateCohortHash":"sha256:73782f9dbd78291cf3d277fac9d13c302d524be2340fa5e3a21737c11481df86","candidateId":"scale500-tmdb-12139","cohortId":"SCALE_TRANCHE_1","schemaVersion":"promotion-candidate.v1","sourceHashes":{"evidencePacket":"sha256:2651f048ad284a73907ed5466784fc4ea4ba8fc6379f04b0247f79f413e84f1d","factsRecord":"sha256:e43e81198ad0441c7d50a6caf4c687b58f77a8bb252bdaf9efcd0d83af658337","semanticArtifact":"sha256:c0daa20f51505b8d120152d51e2f5fa1093333a924d49349ef995eb81b41baf6"},"tmdbId":12139}
